<?xml version="1.0" encoding="UTF-8"?>
<xs:schema xmlns:xs="http://www.w3.org/2001/XMLSchema"
           targetNamespace="http://www.example.com/products"
           xmlns="http://www.example.com/products"
           elementFormDefault="qualified">

    <xs:element name="products">
        <xs:complexType>
            <xs:sequence>
                <xs:element name="product" maxOccurs="unbounded">
                    <xs:complexType>
                        <xs:sequence>
                            <xs:element name="name" type="xs:string" />
                            <xs:element name="price">
                                <xs:simpleType>
                                    <xs:restriction base="xs:integer">
                                        <xs:minExclusive value="0" />
                                    </xs:restriction>
                                </xs:simpleType>
                            </xs:element>
                            <xs:element name="quantity" type="xs:string"/>
                            <xs:element name="product_image" type="xs:anyURI" />
                            <xs:element name="discount">
                                <xs:simpleType>
                                    <xs:restriction base="xs:int">
                                        <xs:minInclusive value="0"/>
                                        <xs:maxInclusive value="100"/>
                                    </xs:restriction>
                                </xs:simpleType>
                            </xs:element>
                            <xs:element name="product_code">
                                <xs:simpleType>
                                    <xs:restriction base="xs:int">
                                    </xs:restriction>
                                </xs:simpleType>
                            </xs:element>
                            <xs:element name="description" type="xs:string" />
                            <xs:element name="product_from" type="xs:string" />
                        </xs:sequence>
                        <xs:attribute name="category" type="xs:string" use="required"/>
                    </xs:complexType>
                </xs:element>    
            </xs:sequence>
        </xs:complexType>
    </xs:element>   

</xs:schema>
